date,name,code,title,rating,target_price,institution,url,2025-盈利预测-收益,2025-盈利预测-市盈率,2026-盈利预测-收益,2026-盈利预测-市盈率,2027-盈利预测-收益,2027-盈利预测-市盈率
2021-02-02,000001,000001,2020年年报点评：四季度利润强劲反弹43%，不良率降至近六年新低,买入,,东吴证券,,,,,,,
2021-02-01,000001,000001,打造全球领先的智能化零售银行,买入,,西南证券,,,,,,,
2021-01-28,贵州茅台,600519,公司深度报告：复盘2020：质量为本，稳字当头,买入,,信达证券,,,,,,,
2021-01-18,贵州茅台,600519,加大拆箱促开瓶消费，十四五成长确定性高，值得长期坚守,买入,,中银证券,,,,,,,
2021-01-06,贵州茅台,600519,2020年度生产经营情况点评：全年增长稳健，十四五目标确保稳定增长,增持,,川财证券,,,,,,,
2021-01-05,贵州茅台,600519,贵州茅台经营数据点评：收入达成目标，十三五完美收官,买入,,太平洋,,,,,,,
2021-01-04,贵州茅台,600519,业绩预告略超我们预期，业务成长确定性仍最强,买入,,华安证券,,,,,,,
2021-01-04,贵州茅台,600519,2020年度生产经营情况点评：整体经营稳健，“十四五”行以致远,买入,,民生证券,,,,,,,
2020-12-29,贵州茅台,600519,贵州茅台跟踪报告：拨开迷雾看经营，业绩稳快不可挡,增持,,海通国际,,,,,,,
2020-12-28,000001,000001,积极进取的零售银行，受益于经济复苏，消费端回暖,增持,,群益证券,,,,,,,
2020-12-24,贵州茅台,600519,再划转股份或超预期，十四五可展望年增双位数,买入,,华安证券,,,,,,,
2020-12-22,贵州茅台,600519,重大事件快评：十三五圆满收官，十四五开启高质量发展新征程,买入,,国信证券,,,,,,,
2020-12-01,000001,000001,金融科技赋能，零售对公协同发展,买入,,中银证券,,,,,,,
2020-11-30,贵州茅台,600519,事项点评报告：Q4直销放量渠道优化进行时，飞天批价仍坚挺,增持,,万联证券,,,,,,,
2020-10-29,贵州茅台,600519,贵州茅台三季报点评：主营业务稳健，直销比例同比提升,买入,,太平洋,,,,,,,
2020-10-27,贵州茅台,600519,直营渠道持续改善 稳步实现全年目标,买入,,第一上海证券,,,,,,,
2020-10-27,贵州茅台,600519,业绩低于预期，未来增长确定性高，值得长期坚守,买入,,中银证券,,,,,,,
2020-10-27,贵州茅台,600519,2020三季报点评：直营占比继续提升，全年双位数增长有望顺利达成,买入,,国信证券,,,,,,,
2020-10-26,000001,000001,平安银行：净利润增速回正，资产质量拐点已现,买入,,太平洋,,,,,,,
2020-10-26,贵州茅台,600519,Q3稳健，且看长远,买入,,东吴证券,,,,,,,
2020-10-26,贵州茅台,600519,公司信息更新报告：直营渠道高增长，茅台酒稳健发展,买入,,开源证券,,,,,,,
2020-10-26,贵州茅台,600519,十三五有望平稳收官，十四五仍值得期待,买入,,华安证券,,,,,,,
2020-10-26,贵州茅台,600519,2020年三季报点评：直营渠道持续放量，全年增长目标确定性高,增持,,川财证券,,,,,,,
2020-10-26,贵州茅台,600519,2020年三季报点评：直营支撑公司增长，全年任务稳步推进,买入,,民生证券,,,,,,,
2020-10-26,贵州茅台,600519,季报点评报告：稳健发展为先，直营继续发力,增持,,万联证券,,,,,,,
2020-10-26,贵州茅台,600519,业绩平稳增长，直营占比继续提升,买入,,山西证券,,,,,,,
2020-10-26,贵州茅台,600519,收入利润稳健增长 全年目标达成可期,买入,,华金证券,,,,,,,
2020-10-26,贵州茅台,600519,渠道改革初见成效，直营占比持续提升,买入,,西南证券,,,,,,,
2020-10-26,贵州茅台,600519,业绩稳定增长，全年目标无虞,买入,,国金证券,,,,,,,
2020-10-23,000001,000001,夯实基础促稳健经营，零售发力战略执行坚定,买入,,中银证券,,,,,,,
2020-10-23,000001,000001,平安银行2020年三季报业绩点评：业绩“V”型反转，支撑估值持续修复,增持,,新时代证券,,,,,,,
2020-10-23,000001,000001,单季净利润显著回升，资产质量改善超预期,买入,,东兴证券,,,,,,,
2020-10-22,000001,000001,详细解读平安银行2020年三季报：两市首份银行三季报，利润增速触底回升,买入,,民生证券,,,,,,,
2020-10-22,000001,000001,Profit expansion back on track; Asset quality a bright spot,买入,,招银国际,,,,,,,
2020-10-22,000001,000001,不良核销力度加大，Q3净息差优化明显,买入,,华金证券,,,,,,,
2020-10-22,000001,000001,2020年三季报点评：三季报回暖振奋人心，不良率因何大幅下行？,买入,,东吴证券,,,,,,,
2020-10-22,000001,000001,季报点评报告：资产质量好于市场预期,增持,,万联证券,,,,,,,
2020-10-22,000001,000001,1-3Q2020业绩点评：3Q净利增速回升，源于资产质量改善反哺,增持,,群益证券,,,,,,,
2020-08-31,000001,000001,平安银行2020年中报业绩点评：夯实转型基础，主动加大拨备计提,增持,,新时代证券,,,,,,,
2020-08-28,000001,000001,Bottom line disappoints but core earnings resilient,买入,,招银国际,,,,,,,
2020-08-28,000001,000001,拨备前利润增速稳健，关注资产质量表现,买入,,中银证券,,,,,,,
2020-08-28,000001,000001,拨备前利润维持高增，资产质量稳健,买入,,东兴证券,,,,,,,
2020-08-28,000001,000001,半年报点评报告：拨备前利润实现较高增长,增持,,万联证券,,,,,,,
2020-08-28,000001,000001,2020年中报点评：利润下滑11%与拨备覆盖率提升32pct,买入,,东吴证券,,,,,,,
2020-08-28,000001,000001,详细解读平安银行2020年半年报：低调的利润增速藏不住靓丽的基本面,买入,,民生证券,,,,,,,
2020-08-28,000001,000001,零售转型依旧亮眼、关注信用卡不良率抬升,买入,,华金证券,,,,,,,
2020-07-30,贵州茅台,600519,直营占比继续提升，龙头业绩稳健增长,买入,,东兴证券,,,,,,,
2020-07-30,贵州茅台,600519,改革深化，行稳致远,买入,,新时代证券,,,,,,,
2020-07-29,贵州茅台,600519,半年报点评报告：直营加速放量，全年目标底气十足,增持,,万联证券,,,,,,,
2020-07-29,贵州茅台,600519,收入利润稳健增长 持续彰显龙头风范,买入,,华金证券,,,,,,,
2020-07-29,贵州茅台,600519,2020年中报点评：直营渠道持续放量，全年10%增长确定性高,增持,,川财证券,,,,,,,
2020-07-29,贵州茅台,600519,时间过半任务过半，核心资产稳健前行,买入,,东吴证券,,,,,,,
2020-07-29,贵州茅台,600519,业绩稳健增长，直营渠道加速落地,买入,,山西证券,,,,,,,
2020-07-29,贵州茅台,600519,2020年半年点评：任务过半目标如期完成，直营渠道放量显著提速,买入,,民生证券,,,,,,,
2020-07-29,贵州茅台,600519,业绩稳健增长，未来确定性高,买入,,中银证券,,,,,,,
2020-07-29,贵州茅台,600519,中报符合预期，唯需紧密关注供给,买入,,华安证券,,,,,,,
2020-07-29,贵州茅台,600519,贵州茅台中报点评：短期减速不改长期逻辑，报表质量明显回升,买入,,太平洋,,,,,,,
2020-07-29,贵州茅台,600519,行稳致远，直营占比持续提升,买入,,西南证券,,,,,,,
2020-07-28,贵州茅台,600519,产能释放新周期，量价齐升仍可期,买入,,华安证券,,,,,,,
2020-06-23,000001,000001,首次覆盖报告：科技引领，零售突破：打造全球领先的智能化商业银行,增持,,新时代证券,,,,,,,
2020-04-30,贵州茅台,600519,酱香龙头扬帆起航，20Q1稳健增长,买入,,国金证券,,,,,,,
2020-04-29,贵州茅台,600519,渠道吸纳能力强，业绩如期实现双位数增长,买入,,中银证券,,,,,,,
2020-04-29,贵州茅台,600519,季报点评报告：Q1如期开门红，龙头表率为板块注入强心针,增持,,万联证券,,,,,,,
2020-04-28,贵州茅台,600519,压力下显成色，向确定性要溢价,买入,,东吴证券,,,,,,,
2020-04-28,贵州茅台,600519,业绩稳健增长，全年无忧,买入,,西南证券,,,,,,,
2020-04-28,贵州茅台,600519,收入利润均超预期 疫情下凸显龙头确定性,买入,,第一上海证券,,,,,,,
2020-04-28,贵州茅台,600519,公司信息更新报告：一季报迎来开门红，2020年业绩确定性强,买入,,开源证券,,,,,,,
2020-04-28,贵州茅台,600519,起锚“后千亿”开局良好，直营贡献率提升,买入,,新时代证券,,,,,,,
2020-04-28,贵州茅台,600519,贵州茅台一季报点评：业绩略超预期，龙头抗风险能力凸显,买入,,太平洋,,,,,,,
2020-04-28,贵州茅台,600519,2020年一季报点评：20Q1业绩稳健增长，全年业绩确定性仍冠绝行业,买入,,民生证券,,,,,,,
2020-04-28,贵州茅台,600519,2020年一季报点评：渠道改革效果明显，一季报业绩稳健,增持,,川财证券,,,,,,,
2020-04-24,贵州茅台,600519,股价再创新高，2020年业绩确定性强,增持,,川财证券,,,,,,,
2020-04-23,贵州茅台,600519,年报点评报告：2019顺利收官略超指引，后千亿时代发展可期,增持,,万联证券,,,,,,,
2020-04-23,贵州茅台,600519,19年顺利收官，20年拥抱确定性,买入,,国金证券,,,,,,,
2020-04-23,贵州茅台,600519,19年完美收官，业绩稳健增长,买入,,山西证券,,,,,,,
2020-04-23,贵州茅台,600519,"2019 results largely in line, resilient growth ahead",买入,,高盛高华证券,,,,,,,
2020-04-22,贵州茅台,600519,公司信息更新报告：直营如期提速，业绩增长稳健,买入,,开源证券,,,,,,,
2020-04-22,贵州茅台,600519,2019年报点评：贵州茅台业绩符合预期，全年10%收入目标不改,增持,,川财证券,,,,,,,
2020-04-22,贵州茅台,600519,2019稳健收官，2020值得期待,买入,,中银证券,,,,,,,
2020-04-22,贵州茅台,600519,收入稳中有升，直销渠道改革推进,买入,,华鑫证券,,,,,,,
2020-04-22,贵州茅台,600519,而今迈步从头越，穿越周期看茅台,买入,,东吴证券,,,,,,,
2020-04-22,贵州茅台,600519,2019年报点评：2019年实现稳健增长，2020年确定性仍冠绝行业,买入,,民生证券,,,,,,,
2020-04-22,贵州茅台,600519,贵州茅台年报：净利润略超预期，继续维持健康增长,买入,,太平洋,,,,,,,
2020-04-22,000001,000001,盈利保持高速增长，资产质量表现平稳,买入,,东兴证券,,,,,,,
2020-04-22,贵州茅台,600519,量价齐升，带动业绩稳健增长,买入,,西南证券,,,,,,,
2020-04-22,000001,000001,季报点评报告：一季度净息差保持基本稳定,增持,,万联证券,,,,,,,
2020-04-22,000001,000001,平安银行：一季报表现亮眼，维持较快增速,买入,,太平洋,,,,,,,
2020-04-21,000001,000001,2020年一季报点评：逆势强劲增长14.8%，资产质量总体稳定,买入,,东吴证券,,,,,,,
2020-04-21,000001,000001,点评平安银行一季报：无惧疫情影响，用实力说话,买入,,民生证券,,,,,,,
2020-04-21,000001,000001,盈利增速超预期提升，风险抵补能力增强,买入,,中银证券,,,,,,,
2020-04-21,000001,000001,Solid earnings momentum; Asset quality trend is key to watch,买入,,招银国际,,,,,,,
2020-04-02,贵州茅台,600519,公司信息更新报告：行业逐渐回暖，公司稳中求进,买入,,开源证券,,,,,,,
2020-03-23,000001,000001,Conference call takeaway – Business outlook remains solid,买入,,招银国际,,,,,,,
2020-03-19,贵州茅台,600519,公司首次覆盖报告：量价空间充足，增长确定性强,买入,,开源证券,,,,,,,
2020-03-06,贵州茅台,600519,贵州茅台：新老交棒，后千亿时代延续上升周期,买入,,太平洋,,,,,,,
2020-03-05,贵州茅台,600519,事件点评：公司人事发生变动，“后千亿”时代可期,增持,,川财证券,,,,,,,
2020-03-02,000001,000001,平安银行深度报告：零售对公双拳出击，旗帜鲜明推平安,买入,,民生证券,,,,,,,
2020-03-02,贵州茅台,600519,行稳方致远，质地享溢价,买入,,东吴证券,,,,,,,
2020-02-25,贵州茅台,600519,首次覆盖报告：行稳致远，工匠精神打造液体金字塔,增持,,万联证券,,,,,,,
2020-02-22,000001,000001,透视平安集团年报，掘金银行资源禀赋,买入,,东吴证券,,,,,,,
2020-02-19,000001,000001,对公复苏，负债改善，净息差强势,买入,,东吴证券,,,,,,,
2020-02-17,000001,000001,零售业务稳健发展 关注资产质量变动,增持,,万联证券,,,,,,,
2020-02-16,000001,000001,平安银行年报点评：夯实资产质量，蓄力未来发展,买入,,太平洋,,,,,,,
2020-02-16,000001,000001,4Q19业绩亮点-息差企稳，派息提升,买入,,招银国际,,,,,,,
2020-02-14,000001,000001,主营业务增长强劲，关注资产质量表现,买入,,中银证券,,,,,,,
2020-02-14,000001,000001,平安银行年报点评：夯实资产质量，改善存款成本,买入,,民生证券,,,,,,,
2020-02-14,000001,000001,Stable NIM and rising dividend payout highlight 4Q19 results,买入,,招银国际,,,,,,,
2020-02-14,000001,000001,息差彰显韧性、资产质量持续优化,买入,,华金证券,,,,,,,
2020-02-14,000001,000001,2019年年报点评：拨备计提增加，不良认定趋严,买入,,群益证券,,,,,,,
2020-01-14,000001,000001,2019年业绩快报点评：主动计提拨备，对公业务复苏初显成效,买入,,东吴证券,,,,,,,
2020-01-14,000001,000001,存贷业务快增，不良认定趋严,买入,,中银国际,,,,,,,
2020-01-14,000001,000001,平安银行业绩快报点评：清理包袱加快放贷，真实盈利能力改善,买入,,民生证券,,,,,,,
2020-01-06,贵州茅台,600519,业绩略低于预期，稳基础，期待后千亿时代,买入,,西南证券,,,,,,,
2020-01-05,贵州茅台,600519,2019年低于预期，2020年稳字当头，提价可能性仍然存在,买入,,中银国际,,,,,,,
2020-01-03,贵州茅台,600519,重视稳健发展，后千亿时代增长动力足,买入,,华金证券,,,,,,,
2020-01-03,贵州茅台,600519,贵州茅台：销量计划超预期，无需担忧季度波动,买入,,太平洋,,,,,,,
2020-01-03,贵州茅台,600519,基础建设年，稳中求进取,买入,,东吴证券,,,,,,,
2020-01-02,贵州茅台,600519,事件点评：贵州茅台利润增速不及预期，2020年将以稳为主线,增持,,川财证券,,,,,,,
2019-12-30,贵州茅台,600519,强基固本“后千亿”，2020规划量超市场预期,买入,,新时代证券,,,,,,,
2019-12-27,贵州茅台,600519,事件点评：贵州茅台明年计划量3.45万吨，自营规模将大幅提升,增持,,川财证券,,,,,,,
2019-12-26,贵州茅台,600519,贵州茅台：茅台股权划转，助力政府融资发展,买入,,太平洋,,,,,,,
2019-10-23,000001,000001,Long-term prospect stays intact despite some NIM pressure,买入,,招银国际,,,,,,,
2019-10-23,000001,000001,平安银行：资产质量稳定，业绩依然保持较快增长,买入,,太平洋,,,,,,,
2019-10-23,000001,000001,2019年三季报点评：净利润保持高增长，资产质量平稳，风险抵补能力提升,买入,,东莞证券,,,,,,,
2019-10-23,000001,000001,三季报点评：业绩基本符合预期，收入端增长强劲,买入,,群益证券,,,,,,,
2019-10-22,000001,000001,营收增速提升，息差环比收窄,买入,,中银国际,,,,,,,
2019-10-22,000001,000001,平安银行三季报点评：利润高增长，零售快转型,增持,,民生证券,,,,,,,
2019-10-22,000001,000001,2019年三季报点评：ROE持续上行，单季度利润创新高,买入,,东吴证券,,,,,,,
2019-10-22,000001,000001,平安银行2019年三季报点评：零售转型持续显成效，不良平稳,买入,,东兴证券,,,,,,,
2019-10-18,贵州茅台,600519,Direct sales continue to increase,增持,,中国银河国际证券,,,,,,,
2019-10-16,贵州茅台,600519,2019年三季报点评：直营逐步落地，全年14%的收入增长目标可期,增持,,川财证券,,,,,,,
2019-10-16,贵州茅台,600519,2019年三季报点评：业绩短期不及预期，确认节奏保守是主因,买入,,民生证券,,,,,,,
2019-10-16,贵州茅台,600519,直营比例已现拐点，期待持续提升,买入,,西南证券,,,,,,,
2019-10-16,贵州茅台,600519,经营稳步向前，直销陆续放量,买入,,华金证券,,,,,,,
2019-10-16,贵州茅台,600519,体系调整时，稳增长可期,买入,,东吴证券,,,,,,,
2019-10-16,贵州茅台,600519,营收稳健增长，未来一年存在提价的可能性,买入,,中银国际,,,,,,,
2019-10-16,贵州茅台,600519,2019年三季报点评：Q3增速同比有所提升,买入,,东莞证券,,,,,,,
2019-10-16,贵州茅台,600519,贵州茅台三季报点评：多措并举，批价理性回归，发货节奏拖累季度业绩略低预期,买入,,新时代证券,,,,,,,
2019-10-16,贵州茅台,600519,贵州茅台：明年股价空间取决于未来酒价涨幅,买入,,太平洋,,,,,,,
2019-10-16,贵州茅台,600519,业绩略低预期，需求依旧强劲,买入,,国金证券,,,,,,,
2019-10-16,贵州茅台,600519,贵州茅台2019Q3财报点评：渠道改革任重道远，价格管控能力凸显,买入,,东兴证券,,,,,,,
2019-08-14,贵州茅台,600519,贵州茅台：集团销售方案好于预期，旺季放量业绩可期,买入,,太平洋,,,,,,,
2019-08-12,贵州茅台,600519,关联交易计划好于市场预期，3季度有望快速增长,买入,,中银国际,,,,,,,
2019-08-12,贵州茅台,600519,事件点评：贵州茅台关联交易金额符合预期，多措并举控价,增持,,川财证券,,,,,,,
2019-08-12,贵州茅台,600519,贵州茅台事件点评：关联交易合理解决，旺季放量有望带动板块小高潮,买入,,东兴证券,,,,,,,
2019-08-12,贵州茅台,600519,茅台集团营销方案落地，期待旺季放量加快,买入,,华金证券,,,,,,,
2019-08-12,000001,000001,核心指标全面向好，未来持续超预期,买入,,东吴证券,,,,,,,
2019-08-08,000001,000001,业绩全面改善，净息差及不良率表现亮眼,买入,,招银国际,,,,,,,
2019-08-08,000001,000001,All-round improvement; NIM & NPL are bright spots,买入,,招银国际,,,,,,,
2019-08-08,000001,000001,息差表现亮眼，零售贡献度持续提升,买入,,中银国际,,,,,,,
2019-08-08,000001,000001,零售业务步入提质阶段，资产质量优化,买入,,华金证券,,,,,,,
2019-08-08,000001,000001,平安银行2019年半年报点评：盈利能力稳步提升，零售业务不断突破,买入,,东兴证券,,,,,,,
2019-08-08,000001,000001,点评报告：二季度净息差继续上行,增持,,万联证券,,,,,,,
2019-08-08,000001,000001,半年报点评：息差提升推动净利快速增长,增持,,群益证券,,,,,,,
2019-07-22,贵州茅台,600519,贵州茅台中报分析：报表销量或超预期，吨价和预收款合理，净利率提升,买入,,太平洋,,,,,,,
2019-07-19,贵州茅台,600519,存在成长空间，增速虽有下行，不必过分担心,增持,,中邮证券,,,,,,,
2019-07-18,贵州茅台,600519,收入表现波澜不惊，酝酿下一轮超预期表现,买入,,国金证券,,,,,,,
2019-07-18,贵州茅台,600519,巨人再迈大步，完成全年目标决心坚定,买入,,华金证券,,,,,,,
2019-07-18,贵州茅台,600519,营收增速放缓并非终端需求变化,买入,,中银国际,,,,,,,
2019-07-18,贵州茅台,600519,2019年中报点评：静待直营落地，全年增长无忧,增持,,川财证券,,,,,,,
2019-07-18,贵州茅台,600519,Q2高基数稳增长，静待营销体制变革落地,买入,,东吴证券,,,,,,,
2019-07-18,贵州茅台,600519,2019年半年报点评：业绩低于预期，三季度放量是大概率事件,买入,,民生证券,,,,,,,
2019-07-18,贵州茅台,600519,业绩略低于预期，盈利能力提升明显,买入,,西南证券,,,,,,,
2019-07-18,贵州茅台,600519,需求支撑批价，全年业绩增长确定性高,买入,,新时代证券,,,,,,,
2019-07-18,贵州茅台,600519,贵州茅台2019年中报点评：中报业绩符合预期，下半年直营有望放量,买入,,东兴证券,,,,,,,
2019-07-18,贵州茅台,600519,批价坚挺，下半年直营有望落地,买入,,群益证券,,,,,,,
2019-07-15,贵州茅台,600519,事件点评：中报增速同比有所回落,买入,,东莞证券,,,,,,,
2019-07-15,贵州茅台,600519,贵州茅台业绩预告点评：收入利润符合预期，平均吨价提升明显,买入,,太平洋,,,,,,,
2019-07-15,贵州茅台,600519,看好Q3报表端表现，全年业绩增长无需担忧,买入,,国金证券,,,,,,,
2019-07-14,贵州茅台,600519,业绩略低于预期，供需依然偏紧,买入,,西南证券,,,,,,,
2019-07-14,贵州茅台,600519,2019年上半年经营数据点评：上半年业绩符合全年指引，静待直营放量,增持,,川财证券,,,,,,,
2019-07-09,贵州茅台,600519,中秋价格有望坚挺，持续增长给予估值溢价,买入,,东兴证券,,,,,,,
2019-07-02,000001,000001,基本面迎拐点，依托集团转型可期,买入,,中银国际,,,,,,,
2019-07-01,000001,000001,Best proxy to capture the retail banking boom,买入,,招银国际,,,,,,,
2019-07-01,贵州茅台,600519,贵州茅台：享受龙头溢价，提高目标价到1240元,买入,,太平洋,,,,,,,
2019-06-20,贵州茅台,600519,飞天茅台酒的合理价格应多少？,买入,,太平洋,,,,,,,
2019-06-13,贵州茅台,600519,贵州茅台简评：6月份中下旬放量，平均吨价提升明显,买入,,太平洋,,,,,,,
2019-06-06,000001,000001,零售转型步入盈利提升与资产质量优化新阶段,买入,,华金证券,,,,,,,
2019-05-20,贵州茅台,600519,强大品牌力及渠道控制力成就茅台,增持,,川财证券,,,,,,,
2019-05-19,贵州茅台,600519,业绩增速维持高位，渠道变革有望夯实定价基础,买入,,新时代证券,,,,,,,
2019-05-10,贵州茅台,600519,集团分食是短期扰动，北上资金决定短期走势,买入,,太平洋,,,,,,,
2019-05-09,贵州茅台,600519,开门红如期而至，后续关注直营比例提升,买入,,群益证券,,,,,,,
2019-04-30,贵州茅台,600519,2019Q1财报点评：一季度业绩超预期，渠道改革推动业绩快速提升,买入,,东兴证券,,,,,,,
2019-04-26,贵州茅台,600519,2019年一季报点评：业绩高速增长，预收款回落明显,买入,,西南证券,,,,,,,
2019-04-26,贵州茅台,600519,真实需求强劲，未来两年将惊喜不断，继续强烈推荐,买入,,中银国际,,,,,,,
2019-04-26,贵州茅台,600519,一季报点评：一季度再超预期，产品升级是主因,买入,,太平洋,,,,,,,
2019-04-25,贵州茅台,600519,【联讯食饮】贵州茅台：收入利润高增长，直销比例有待提高,增持,,联讯证券,,,,,,,
2019-04-25,贵州茅台,600519,2019年一季报点评：Q1业绩略超预期，Q2直营渠道有望顺利放量,买入,,民生证券,,,,,,,
2019-04-25,贵州茅台,600519,如期迎来开门红，直营落地意在深远,买入,,东吴证券,,,,,,,
2019-04-25,000001,000001,一季报点评：息差回升，资产质量继续改善，净利增长提速,买入,,群益证券,,,,,,,
2019-04-25,000001,000001,2019年一季报点评：业绩提速息差增长，质量扎实拨备增厚,买入,,西南证券,,,,,,,
2019-04-09,贵州茅台,600519,2019Q1业绩预告点评：一季度超预期，价格快速攀升需防范,买入,,东兴证券,,,,,,,
2019-04-08,贵州茅台,600519,事件点评：一季度业绩超预期,买入,,东莞证券,,,,,,,
2019-04-08,贵州茅台,600519,贵州茅台：一季报数据超预期，维持目标价1030元,买入,,太平洋,,,,,,,
2019-04-08,贵州茅台,600519,4Q超预期，期待渠道改革成效,增持,,群益证券,,,,,,,
2019-04-08,贵州茅台,600519,需求强劲，业绩释放动力足，未来2年有望持续超预期,买入,,中银国际,,,,,,,
2019-04-03,贵州茅台,600519,业绩超预期，未来看直营渠道布局,买入,,华鑫证券,,,,,,,
2019-04-01,贵州茅台,600519,2018年报点评：稀缺性助力提价和结构再优化，茅台持续高增速,买入,,东兴证券,,,,,,,
2019-04-01,贵州茅台,600519,价格话语权强化，扬帆千亿基础扎实,买入,,新时代证券,,,,,,,
2019-04-01,贵州茅台,600519,2018年年报点评：量价齐升带动收入高速增长，现金流大幅改善,买入,,西南证券,,,,,,,
2019-03-31,贵州茅台,600519,2018年年报点评：茅台酒确认量超预期推动全年业绩超预期,买入,,民生证券,,,,,,,
2019-03-29,贵州茅台,600519,年报点评：量价齐升再超预期，重新定义空间和风险,买入,,太平洋,,,,,,,
2019-03-29,贵州茅台,600519,【联讯食饮】：4Q重现高增速，需求旺盛确保全年目标实现,增持,,联讯证券,,,,,,,
2019-03-29,贵州茅台,600519,2018年年报点评：Q4增速有所回升,买入,,东莞证券,,,,,,,
2019-03-29,贵州茅台,600519,18年业绩超预期，19年有望明显高于14%的增长规划,买入,,中银国际,,,,,,,
2019-03-29,贵州茅台,600519,Q4利润创新高，渠道变革助增长,买入,,东吴证券,,,,,,,
2019-03-08,000001,000001,年报点评：零售业务高歌猛进，资产质量已得到市场认可,买入,,群益证券,,,,,,,
2019-03-08,000001,000001,平安银行18年报业绩点评：零售贷款驱动业绩，净息差环比向好,增持,,民生证券,,,,,,,
2019-01-24,贵州茅台,600519,冻结经销商数量和经销商配额；重申买入评级（位于强力买入名单）（摘要）,买入,,高华证券,,,,,,,
2019-01-09,000001,000001,业绩快报点评报告：存量资产质量持续改善,增持,,万联证券,,,,,,,
2019-01-04,贵州茅台,600519,业绩预告点评：18业绩稳着陆，19结构调整茅台蓄势待发,买入,,东兴证券,,,,,,,
2019-01-04,000001,000001,平安银行：终将脱颖而出，强烈推荐,买入,,太平洋,,,,,,,
2019-01-03,贵州茅台,600519,贵州茅台：吨价提升超预期，直营增加保障未来增长,买入,,太平洋,,,,,,,
2019-01-03,贵州茅台,600519,2018年业绩和2019年指引符合预期，结构性改革启动,买入,,高华证券,,,,,,,
